{
  "$schema": "http://json-schema.org/draft-07/schema#",
  "description": "",
  "type": "array",
  "items": {
    "description": "",
    "type": "object",
    "properties": {
      "educationId": {
        "description": "",
        "type": "number"
      },
      "patientId": {
        "description": "",
        "type": "number"
      },
      "encounter_date": {
        "description": "",
        "type": "string"
      },
      "dataType": {
        "description": "",
        "type": "string"
      },
      "educationName": {
        "description": "",
        "type": "string"
      },
      "dataValue": {
        "description": "",
        "type": "string"
      },
      "receivedDate": {
        "description": "",
        "type": "string"
      },
      "authorUserId": {
        "description": "",
        "type": "string"
      },
      "authorLogDateUtc": {
        "description": "",
        "type": "string"
      }
    }
  }
}